<?xml version="1.0" encoding="utf-8" ?>
<!--
    Copyright (c) Contributors to the Eclipse Foundation
   
    Licensed under the Apache License, Version 2.0 (the "License");
    you may not use this file except in compliance with the License.
    You may obtain a copy of the License at
   
        http://www.apache.org/licenses/LICENSE-2.0
   
    Unless required by applicable law or agreed to in writing, software
    distributed under the License is distributed on an "AS IS" BASIS,
    WITHOUT WARRANTIES OR CONDITIONS OF ANY KIND, either express or implied.
    See the License for the specific language governing permissions and
    limitations under the License.
   
    SPDX-License-Identifier: Apache-2.0 
 -->

<configuration xmlns="http://org.osgi/zigbee-tck" xmlns:xsi="http://www.w3.org/2001/XMLSchema-instance"
  xsi:schemaLocation="http://org.osgi/zigbee-tck zigbee-tck.xsd">
  <frame headerMaxSize="5" headerMinSize="3" />
  <host panId="0x0033" channel="16" securityLevel="0" ieeeAddress="30DE8600004000F4" discoveryTimeout="1000" invokeTimeout="3000">
    <nodeDescriptor type="2" frequencyBand="868" manufacturerCode="0x0045" maxBufferSize="36"
      isComplexDescriptorAvailable="false" isUserDescriptorAvailable="true" />
  </host>
  <nodes>
    <node ieeeAddress="30DE8600004000F3" hostIeeeAddress="30DE8600004000F4" userDescription="user description"
      activeEndpointsNumber="1">

      <nodeDescriptor type="1" frequencyBand="868" manufacturerCode="0x0045" maxBufferSize="36"
        isComplexDescriptorAvailable="false" isUserDescriptorAvailable="true" />

      <powerDescriptor currentPowerMode="2" currentPowerSource="1" currentPowerSourceLevel="1"
        isConstantMainsPowerAvailable="true" />

      <endpoints>
        <endpoint id="25" inputClustersNumber="2" outputClustersNumber="1">
          <simpleDescriptor deviceId="8" version="4" profileId="7" inputClusters="3,4" outputClusters="4">
          </simpleDescriptor>
        </endpoint>
      </endpoints>
    </node>
  </nodes>
</configuration>